{"$schema":"https://json-schema.org/draft/2020-12/schema","type":"object","additionalProperties":false,"properties":{"version":{"const":"mesh.cos.approval.v1"},"approval_id":{"type":"string"},"task_id":{"type":"string"},"requested_by":{"type":"string"},"approval_owner":{"type":"string"},"authority_level":{"type":"integer","minimum":4,"maximum":5},"action":{"type":"string"},"status":{"enum":["PENDING","APPROVED","REJECTED"]},"requested_at":{"type":"string"},"decided_at":{"type":["string","null"]},"decision_reason":{"type":["string","null"]},"decided_by":{"type":["string","null"]}},"required":["version","approval_id","task_id","requested_by","approval_owner","authority_level","action","status","requested_at","decided_at","decision_reason"]}
